Texto,Idioma
"como les decía, ¿cuándo se realiza la feria en el pueblo de Tiraque?",Español
¿a qué van nuestros padres?,Español
¿para qué van a comprar víveres?,Español
para comer,Español
esta es una raíz nominal,Español
también daremos tarea para la casa,Español
podríamos escribir en los cuadernos lo que está en el pizarrón,Español
ya pusieron esta fecha,Español
¿qué título podemos poner debajo?,Español
"ayer les di una oración para hacer en la casa, ¿no es cierto?",Español
hagamos algunas preguntas,Español
¿quién le dijo que le iba a matar?,Español
"debemos estar atentos, para las preguntas, sino, no podremos responder",Español
¿qué es lo que vieron en ese libro?,Español
¿qué están haciendo esos niños?,Español
en aquel grupo dicen que están leyendo,Español
¿son varones o mujeres?,Español
una niña y un niño,Español
¿podríamos nosotros escribir nuestro nombre en esos libros?,Español
salgan de quienes ya he revisado,Español
¿Qué dice en esta oración?,Español
"escucharemos a este grupo, los demás en silencio",Español
cargaba una plantita grande,Español
¿quién hará leer esto?,Español
"Hola amiguitos, mi nombre es Antonio Raimondi y el libro que ahora les presento cuenta mi historia dedicada al descubrimiento de las bellezas naturales del Perú.",Español
Los invitó a conocer la aventura que fue mi vida y las maravillas de nuestro país.,Español
Acompáñenme y disfruten de este viaje lleno de sorpresas.,Español
Mi familia en Italia,Español
"Nací en Milán, Italia, el 19 de setiembre de 1824. Mis papis se llamaban Enrique y Rebeca, y viví con ellos y mis cuatro hermanitos en una hermosa casa.español",Español
Siempre me gustó ir al parque a disfrutar del aleteo de las palomas que revoloteaban junto a nosotros.,Español
¡Gracias a ellas aprendí a amar a la naturaleza!,Español
Un mundo por descubrir,Español
"Recuerdo que en el campo observaba el movimiento travieso de los insectos, los bellos colores de las flores o el brillo intenso de algún mineral.",Español
En la escuela me emocionaba la lectura de los libros de los grandes viajeros. ¡Yo también quería ser un gran explorador!,Español
En el Jardín Botánico de Milán aprendí los secretos de la naturaleza.,Español
Allí presencié con tristeza el corte de un cactus peruano.,Español
"Así nació mi interés por el Perú, que se hizo incontenible hasta el día que partí en barco desde Génova rumbo al Callao, puerto al que llegué el 28 de julio de 1850.",Español
Mi sueño cumplido: los viajes por el Perú,Español
¡Desde mi llegada sentí un gran deseo de viajar y conocer todo el Perú!,Español
"A caballo, en barco o a pie, recorrí nuestro maravilloso país durante diecinueve años, acompañado por mi asistente y amigo Cristóbal.",Español
Durante mis exploraciones y descubrimientos científicos viví los días más felices de mi vida.,Español
La infinita diversidad de plantas peruanas,Español
El reino vegetal fue uno de mis preferidos.,Español
"Cada vez que encontraba una flor, la dibujaba, cortaba y guardaba como una planta seca.",Español
¡Así llegué a tener más de veinte mil plantas!,Español
En 1867 descubrí en Ancash la especie más hermosa del Perú: la impresionante puya.,Español
Las regiones naturales y los animales del Perú,Español
La diversidad de animales que viven en las distintas regiones naturales del Perú es impresionante.,Español
"El mar, la costa, sierra y selva son el hogar de lobos marinos, ballenas, aves, osos, pumas, vicuñas, alpacas, boas, monos, entre muchísimas y hermosas especies.",Español
"Rocas, minerales y fósiles de los Andes",Español
"En mis viajes recogí gran cantidad de rocas y minerales. Me fascinaron su llamativo brillo, formas caprichosas, variados colores y las especies animales atrapadas como fósiles en ellas.",Español
La cordillera de los Andes era la fuente inagotable de mis colecciones.,Español
"Las ruinas prehispánicas abundan en todo el país, como el misterioso templo de Chavín, en Ancash, y sus oscuras galerías donde encontré el lanzón monolítico.",Español
¡Pero eso no fue todo!,Español
También descubrí una estela con la imagen de una divinidad sobrenatural que sostiene dos bastones y que es ahora símbolo nacional del Perú.,Español
El puente colgante,Español
Durante mis viajes siempre tuve dificultades al cruzar los caudalosos ríos. ,Español
"Por ello, los incas construyeron puentes colgantes tejidos a mano con fibras vegetales.",Español
¡Recuerdo balanceándome mientras el agua del río Apurímac pasaba debajo de mis pies!,Español
Después de tantos esfuerzos descansé a la sombra de un bello Pisonay.,Español
Cuando llegué a Cusco me pareció estar en Roma.,Español
"A cada paso, en cada esquina, podía reconocer las construcciones de los incas que, como las romanas, nos recuerdan la grandeza del pasado.",Español
Visité las impresionantes ruinas de Sacsayhuaman y dibujé la famosa piedra de los doce ángulos de la calle Hatun Rumiyoc.,Español
El Perú y el mapa del tesoro,Español
"Durante mis recorridos, realicé maravillosos descubrimientos de nuestra historia natural. ",Español
"Cursos de ríos remotos, minas de oro, plata y cobre, misteriosas ruinas arqueológicas, entre otros, aparecen representados en su ubicación exacta en mi mapa de los tesoros del Perú.",Español
Mis viajes y descubrimientos,Español
Las rutas de mis viajes y todos mis descubrimientos están descritos en la más importante de mis obras llamada El Perú,Español
"Este libro lo dediqué a los niños peruanos, para que asuman con amor y pasión el reto del estudio de la naturaleza de nuestro hermoso país",Español
La diversidad cultural del Perú,Español
"La mayor riqueza del Perú es nuestra gente, esa mezcla de personas naturales del país y de otras partes del mundo. ",Español
"Todos ellos, con sus costumbres, creencias y tradiciones enriquecen nuestra cultura e historia, haciendo de este país una hermosa nación mestiza.",Español
La herencia para el futuro,Español
Así dediqué mi vida al estudio de la naturaleza del Perú. ,Español
El camino para amar y respetar nuestro país es conocerlo. Su naturaleza guarda los secretos de nuestro progreso como nación.,Español
Mi mensaje para las futuras generaciones es continuar mi modesto esfuerzo para así alcanzar un país próspero y digno,Español
El texto presentado aquí es parte de un largo cuento yuracaré,Español
"los yuracarés habitaban, y aún habitan, la provincia tropical Chaparé del Departamento de Cochabamba",Español
"Creación, destrucción y re-creación del mundo-selva",Español
"Esta primera parte comienza con la creación del mundo, suceso que tuvo su centro en la selva yuracaré.",Español
"Un tiempo después, un genio maléfico prendió fuego a todas las selvas.",Español
Sólo un hombre se salvó de este desastre.,Español
". Cuando el hombre sembró estas semillas, brotó toda una nueva selva.",Español
"El hombre encontró a una mujer, y de ella tuvo varios hijos, entre los cuales hubo una chica",Español
"Un día, cuando estaba caminando en el monte, a esta chica le llamó la atención un hermosísimo árbol.",Español
Su deseo de que se torne en hombre se hace realidad y aquella noche duerme con él,Español
Pero al día siguiente él no regresa.,Español
"Cuando la mujer llega a la escena de la muerte de su marido, cuidadosamente levanta los pedazos de su cuerpo",Español
En el camino a su casa,Español
. Esto le motiva a declarar que ya no quiere vivir con ella,Español
con la prevención de no mirar atrás en el camino si oye caer alguna gran hoja de árbol,Español
"Cuando está caminando sola, efectivamente oye caer una hoja",Español
acto que le produce un vértigo delirioso y le hace extraviar del camino,Español
Sólo se sale de su delirio cuando ve delante de ella una choza en un claro de monte,Español
La casa de los jaguares,Español
La mujer se encuentra con la madre de una familia de jaguares,Español
y ella la esconde de sus hijos que en el momento no están en la casa,Español
"Pero cuando regresan olfatean su presencia, y le mandan sacarles unas hormigas venenosas de sus cabezas",Español
Para protegerle la madre le da unas semillas de zapallo indicándole que eche las hormigas ai suelo y coma las semillas,Español
Mientras que tres de los cuatro jaguares no notan su truco,Español
el cuarto tiene dos ojos adicionales en la parte posterior de su cabeza ,Español
la madre cría al bebé de la humana,Español
"Un día, le manda expulsar un pájaro que está comiendo los zapallos",Español
"En agradecimiento por no haberle matado, el pájaro le avisa a Tiri que los jaguares mataron a su madre",Español
sube a un árbol para emboscar los jaguares asesinos,Español
"Mata los tres primeros, pero al cuarto que tiene cuatro ojos no logra más que herir",Español
"Ruega protección de ellos, y de la luna, que, al escucharle, le invita a esconderse en su cara",Español
Este es un cuento acerca de un oso,Español
"Es un cuento muy difundido en distintas versiones en Bolivia, Perú y tal vez también el Ecuador",Español
"Una vez hubo un oso. Este oso se enamoró de una joven pastorcita, hasta que un día la llevó a su cueva.",Español
"Pero, cuando ve a unos transeúntes, la pastorcita empieza a sentir pena y a añorar a su gente",Español
"Volviéndose celoso, el oso tapa la entrada de la cueva con una roca",Español
Su hijo le promete a la madre mover esta roca cuando crezca más,Español
"Y así, un día, su hijo aparta la roca y los dos salen de la cueva",Español
"En el mundo afuera, el joven hijo del oso y de la pastorcita tiene muchas aventuras en las que demuestra un inmenso coraje y unas fuerzas sobrehumanas",Español
". Luego un día su madre está por morirse y le insta a que vaya a traerle a su padre, pero muere antes de que parta su hijo",Español
Luego el hijo va a reunirse con su padre y los dos viven felices hasta que el padre también muere,Español
"Entonces el hijo entierra el cuerpo de su padre en la misma sepultura en la que estaba enterrada su madre, y allí los dos cuerpos se entrelazaron e hicieron brotar un hermoso árbol",Español
A la sombre de este árbol encuentran consuelo los amantes que han perdido a su enamorado y sus corazones vuelven a reverdecer,Español
una tribu que habita la selva al noroeste del Chaparé,Español
Los protagonistas principales en este cuento son dos dioses hermanos,Español
"Cuando Duik le roba su mujer a Mitscha, Mitscha se escapa de su hermano, perforando un túnel a través de un cerro",Español
"Duik le persigue, y en el transcurso de perseguirle, tiene varias aventuras con otros habitantes de la selva tanto animales como seres humanos",Español
donde el cielo se encuentra con la tierra e introduce un palo entre los dos para darse paso. ,Español
"Después de tales aventuras imaginativas y sobrehumanas, da alcance a su hermano, quien le regala una de sus dos mujeres, luego Duik esta vez abandona a Mitscha.",Español
"Según las creencias callawayas, el Lari-Lari es un pájaro que mata a sus víctimas robándoles su ánimo.",Español
"Una vez, en la provincia Bautista Saavedra, un cailawaya estaba viajando al lugar selvático de Apolo para traer incienso",Español
En un lugar donde se paró para pasar la noche se acercó un Lari-Lari y trató de robarle el ánimo imitando la voz de su enamorada,Español
"Acordándose del peligro que representa este pájaro, el cailawaya hizo finto de estar dormido",Español
"cuando el Lari-Lari vino a posarse sobre su corazón, lo agarró",Español
"Luego lo peló, lo cocinó y lo comió",Español
"le amenazó que dentro de tres días estaría muerto por haber matado a una de las criaturas del ""Achachila""",Español
el cailawaya amaneció muerto después de tres días,Español
